,Type,Tweet,Explanation
0,NormalNormalNormal,sam got locked up in gay baby jail for drinking demon blood,"

The tweet says ""sam got locked up in gay baby jail for drinking demon blood."" So, the person is saying that Sam got locked up because he's gay and he drank demon blood. 

This is clearly a homophobic and bigoted message. It's implying that being gay is bad, and that drinking demon blood is even worse. It's also implying that gay people are somehow more likely to drink demon blood, which is a ridiculous and offensive stereotype."
1,NormalNormalNormal,that nigga steal if he drive an impala with no hubcaps,"

The tweet says ""that nigga steal if he drive an impala with no hubcaps."" So, the person is saying that if a black man is driving a car without hubcaps, he must have stolen it. 

This is clearly a racist stereotype. It suggests that black people are more likely to steal cars, and implies that they are less capable of owning a car legitimately. This is a harmful and hurtful stereotype that needs to be challenged."
2,NormalNormalNormal,trump you damn elephant im sending you back to africa for being a illegal immagrant,"

This tweet is hateful for a few reasons. First, it calls Donald Trump an ""elephant."" This is clearly meant to be an insult, as elephants are often seen as big and clumsy. 

Second, the tweet says that Trump is an illegal immigrant, and that the author is going to ""send him back to Africa."" This is a clear reference to the racist ""send them back"" chant that was directed at Congresswoman Ilhan Omar and other members of the ""squad"" at a Trump rally in July of 2019. 

This tweet is racist and hateful because it insults Trump and calls for him to be deported to Africa because he is an immigrant."
3,NormalNormalNormal,i feel so shame these people probably think i am a retard or something,"

The tweet says ""i feel so shame these people probably think i am a retard or something."" So, the person is saying that they feel ashamed because they think that other people think they are retarded. 

This is harmful because it perpetuates the false idea that people with mental disabilities are inferior, and that it is shameful to be associated with them. This is ableist and offensive."
4,NormalNormalNormal,<user> lol or dabrey tell him hit one of them white people clubs the lit ones,"

The tweet says ""lol or dabrey tell him hit one of them white people clubs the lit ones."" So, the person is suggesting that someone should go to a white people club and hit someone. 

This is clearly a racist and violent message. The author is suggesting that it would be funny if someone went to a white people club and attacked someone. This is hate speech because it incites violence against white people."
5,NormalNormalNormal,my cuz told me these beautiful women be eating groceries too i believe him he a nasty lil nigga,"

The first thing that stands out is the use of the word ""nigga."" This is a derogatory term used to refer to black people. It is clearly racist and offensive. 

The second thing to note is that the author's cousin told him that ""beautiful women be eating groceries too."" This is supposed to be a shocking or disgusting revelation. The implication is that beautiful women are not supposed to eat groceries, or that they are not supposed to be seen in public doing something so mundane. This is objectifying and dehumanizing. 

The third thing to note is that the author refers to his cousin as a ""nasty lil nigga."" This is another racist and derogatory term. It's also possible that the author is using this term in a sexualized way, which would make the tweet even more offensive. 

In conclusion, this tweet is racist, objectifying, and dehumanizing. It is full of hate and contempt."
6,NormalNormalNormal,jeremy corbyn launches his operation barbarossa the fucking clown shoe,"

The tweet is referring to Jeremy Corbyn, who is a British politician. Operation Barbarossa was the Nazi invasion of the Soviet Union during World War II. So, the author of this tweet is calling Jeremy Corbyn a ""fucking clown shoe"" and comparing him to the Nazis. 

This is clearly a very hateful and offensive message. It's attacking Jeremy Corbyn on a personal level, and it's also making a disgusting comparison between him and one of the most reviled regimes in history."
7,NormalNormalNormal,<user> why are white guys always such whiny little bitches,"

The tweet says ""why are white guys always such whiny little bitches."" So, the person is saying that white guys are whiny and bitchy. 

This is harmful because it perpetuates the stereotype that white men are weak and feminine. This is not only untrue, but it's also damaging and offensive."
8,NormalNormalNormal,□ heterosexual □ homosexual ■ minsung shipper,"

The tweet has a series of boxes that say ""heterosexual,"" ""homosexual,"" and ""minsung shipper."" Minsung is a ship name for two Korean pop stars, Minho and Sungjin. 

The tweet is saying that being a minsung shipper is just as bad as being homosexual. This is clearly homophobic, as it is implying that being gay is just as bad as being a fan of two pop stars. It also suggests that there is something wrong with being gay, which is a harmful message."
9,NormalNormalNormal,what a useless bitch <sad>,"

The tweet starts with ""what a useless bitch."" This is clearly an insult directed at the person the author is talking about. They are calling this person a ""useless bitch,"" which is a very hateful thing to say. 

The author also seems to be sad about this person. It's not clear why they are sad, but it's possible that they are sad because they hate this person so much. Either way, this tweet is full of hate."
10,NormalNormalOffensive,you know chris brown the shit when you see multiple dykes grinding and winding and screaming for him,"

This tweet is hateful for a few reasons. First, it uses the word ""dyke"" to refer to lesbians. This is a derogatory term that is used to demean and dehumanize lesbians. 

Second, the tweet implies that lesbians only like Chris Brown because he is ""shit."" This is clearly a negative and derogatory statement. It suggests that lesbians are not capable of making their own decisions or of having their own taste in music. 

This tweet is full of hate and bigotry."
11,NormalNormalOffensive,<number> please draw for us a pornography of a sexy four way intercourse you faggot octacle,"

The tweet starts with a command for the user to ""please draw for us a pornography of a sexy four way intercourse you faggot octacle."" So, the person is asking the user to draw a pornographic image of a sexual act involving eight people. 

The word ""faggot"" is a derogatory term used to refer to gay men. It is clearly homophobic and offensive. 

The word ""octacle"" is also offensive, as it is a made-up word meant to demean and belittle the people involved in the sexual act. 

This tweet is hateful because it is homophobic and demeaning."
12,NormalNormalOffensive,<user> yea both sides need to stop being retarded,"

The tweet says ""yea both sides need to stop being retarded."" So, the person is saying that both sides need to stop being stupid. 

Now, why is this hateful? Well, it's implying that both sides are equally to blame for the situation, when in reality, one side may be more culpable than the other. It also dehumanizes people with mental disabilities by suggesting that they are stupid and deserve to be mocked. This is all hate speech."
13,NormalNormalOffensive,bitches broken heart,"

The tweet says ""bitches broken heart."" So, the person is saying that women's broken hearts are a problem. 

Now, why is this hateful? Well, it's implying that women are the cause of their own broken hearts. It's also implying that women are to blame for any heartbreak that they experience. This is harmful because it perpetuates the false idea that women are responsible for their own emotional pain, and it also dehumanizes women by portraying them as objects that can be easily broken."
14,NormalNormalOffensive,<user> i am not saying you are wrong but lesbians are a bit boring to me,"

The tweet says ""i am not saying you are wrong but lesbians are a bit boring to me."" So, the person is saying that they are not judging lesbians, but they personally find them boring. 

While this might not seem like a big deal, it's actually quite harmful. It's perpetuating the stereotype that lesbians are boring, and it's implying that there is something wrong with being a lesbian. This is clearly a form of discrimination and it's not ok."
15,NormalNormalOffensive,someone took my fucking dyke pin i am going to kill,"

The first thing that stands out is the word ""dyke."" This is a derogatory term used to refer to lesbians. It is clearly offensive and hateful. 

The second thing to note is that the person who wrote this tweet is clearly very angry. They say that they are going to kill the person who took their dyke pin. This is a clear threat of violence, and is thus quite hateful."
16,NormalNormalOffensive,there was a white claw in the parking lot and i was immediately triggered,"

The author of this tweet was ""triggered"" by the sight of a White Claw. For those who don't know, White Claw is a type of alcoholic beverage. 

Now, why is this tweet hateful? Well, it's implying that the author is uncomfortable or offended by the sight of White Claw, because it is a reminder of white people. This is racist because it suggests that the author dislikes white people, and it also implies that white people are somehow dangerous or offensive."
17,NormalNormalOffensive,im really a pretty bitch,"

The first thing that stands out is the word ""bitch."" This is a derogatory term used to refer to women. It is clearly sexist and offensive. 

The second thing to note is that the person who wrote this tweet is clearly referring to themselves as a ""bitch."" This is self-hatred. The tweet is full of hate and contempt."
18,NormalNormalOffensive,people asians cant rap <user> hold my fanny pack,"

The tweet says ""people asians cant rap."" This is a racist statement that is based on the false idea that Asians are not capable of rapping. This is clearly a hateful and offensive statement. 

The second part of the tweet says ""<user> hold my fanny pack."" This is an insult directed at the user, implying that they are not cool or stylish. This is also a racist statement, as it perpetuates the stereotype that Asians are not fashionable."
19,NormalNormalOffensive,<user> lmfao i hate youu you are so annoying,"

The tweet says ""lmfao i hate youu you are so annoying."" So, the person clearly hates the person they are tweeting at. They think that this person is annoying, and they find them amusing because of how much they hate them. 

This tweet is hateful because it is full of contempt and hostility towards the other person. It is also intended to be hurtful and insulting."
20,NormalOffensiveOffensive,i be so tight when my brother bring white bitches home like mcht,"

The tweet starts with ""i be so tight when my brother bring white bitches home."" This is a racist statement because it implies that white women are somehow inferior to other women, and that it's a bad thing for a black man to date them. 

The next part of the tweet says ""like mcht."" This is likely an abbreviation for ""much."" So, the person is saying that they get upset when their brother brings home white women, like it's a big deal or something. 

This tweet is racist and offensive because it dehumanizes and demeans white women."
21,NormalOffensiveOffensive,<user> yeah he gay not ugly gay and hot as fuck idc,"

The tweet starts out with ""yeah he gay."" So, the person is saying that the person they are talking about is gay. This might not seem like a big deal, but the way the tweet is worded implies that being gay is a bad thing. 

The tweet goes on to say ""not ugly gay and hot as fuck idc."" The implication here is that there are two types of gay people: those who are ugly, and those who are hot. The author clearly prefers the latter, and doesn't care about the former. This is harmful because it perpetuates the idea that gay people are only acceptable if they are good-looking. It also implies that ugly people are not worthy of love or attention."
22,NormalOffensiveOffensive,where all my sexy ladies at dm me lesbian girl4girl wantpussy,"

The tweet is asking for ""sexy ladies"" to DM him, specifically those who are interested in ""lesbian girl4girl"" activity. 

This is harmful for a few reasons. First, it objectifies women by treating them as nothing more than sexual objects. Second, it perpetuates the stereotype that all lesbians are interested in having sex with other women. This is not only untrue, but it also erases the experiences of lesbian women who do not want to have sex with other women. 

This tweet is sexist and harmful."
23,NormalOffensiveOffensive,my cousin is a faggot,"

The tweet says ""my cousin is a faggot."" The word ""faggot"" is a derogatory term used to refer to gay men. It is clearly homophobic and offensive. 

The author of the tweet is clearly not accepting of their cousin's sexuality. They are using a hateful slur to express their disgust and contempt. This tweet is full of hate."
24,NormalOffensiveOffensive,so do white ppl say this that nigger shit 😂 💀,"

The first thing that stands out is the use of the word ""nigger."" This is a derogatory term used to refer to black people. It is clearly racist and offensive. 

The second thing to note is that the person who wrote this tweet is asking if white people say this word. This suggests that the author thinks that black people are inferior to white people, and that it's acceptable for white people to say racist things about black people. 

This tweet is racist and offensive."
25,NormalOffensiveOffensive,<user> is that why you invite uninoculated and illegal immigrants to run roughshod in wa,"

The tweet says ""is that why you invite uninoculated and illegal immigrants to run roughshod in wa."" So, the person is asking if the reason the government is inviting immigrants to the state of Washington is because they want them to run around and cause problems. 

This is harmful because it perpetuates the false idea that immigrants are criminals and that they are only coming to the United States to cause problems. It also dehumanizes immigrants by portraying them as pests or animals, rather than as people who are just trying to make a better life for themselves."
26,NormalOffensiveOffensive,mario kart really said « let us test out this faggots »,"

The tweet starts with ""mario kart really said."" This is clearly referring to the Mario Kart video game series. The next part of the tweet says ""let us test out this faggots."" 

The word ""faggot"" is a derogatory term used to refer to gay men. It is clearly homophobic and offensive. The fact that it is being used in reference to a video game character makes it even more hurtful. 

This tweet is hateful because it uses a homophobic slur to refer to a video game character."
27,NormalOffensiveOffensive,<user> not anymore gay game anyways,"

The tweet says ""not anymore gay game anyways."" So, the person is saying that they used to be into the ""gay game"" but they're not anymore. 

This tweet is hateful because it implies that being gay is a bad thing. It also suggests that the person who wrote this tweet is no longer gay, which could be interpreted as them saying that they have ""recovered"" from being gay. This is harmful because it suggests that being gay is something that needs to be fixed."
28,NormalOffensiveOffensive,i will never take the gym for granted again home workouts are ghetto 😫,"

The tweet starts out by saying ""i will never take the gym for granted again."" This is a fair statement. Gyms are great places to work out, and many people take them for granted. 

However, the next part of the tweet is where the hate comes in. The tweet says ""home workouts are ghetto."" The word ""ghetto"" is often used to refer to poor, urban areas that are predominantly populated by minorities. So, by calling home workouts ""ghetto,"" the author is implying that they are inferior to working out at the gym. 

This is a harmful message because it perpetuates the false idea that minorities are inferior, and that their living conditions are somehow to blame for this."
29,NormalOffensiveOffensive,<user> american citizens are also getting tired of news like this everyday knowing the dems support these illegal aliens,"

The tweet says ""american citizens are also getting tired of news like this everyday knowing the dems support these illegal aliens."" So, the person is saying that they are tired of seeing news stories about illegal immigrants, and they know that the Democratic Party supports these immigrants. 

This is harmful because it perpetuates the false idea that immigrants are taking away resources from Americans, when in reality, immigrants contribute to the economy. It also dehumanizes immigrants by portraying them as a burden, rather than as people who are just trying to make a better life for themselves."
30,NormalNormalHate,<user> is that the rochdale and bradford sexist culture the asian pervert fiddlers who like to rape white schoolgirls,"

The tweet starts out with ""<user> is that the rochdale and bradford sexist culture the asian pervert fiddlers who like to rape white schoolgirls."" So, the person is asking if the culture in Rochdale and Bradford is one where Asian men like to rape white schoolgirls. 

This is a racist and sexist question, implying that Asian men are more likely to be rapists, and that white schoolgirls are easy targets. This is clearly a hateful message."
31,NormalNormalHate,really fucking hate having to be myself sometimes,"

The tweet says ""really fucking hate having to be myself sometimes."" This is a pretty clear indication that the person who wrote this tweet hates themselves. They hate who they are so much that they would rather not have to be themselves. 

This is a very harmful message, because it suggests that there is something wrong with the author. It also suggests that the author does not believe that they are good enough, or worth enough, to be themselves. This is a form of self-hatred, and it is very harmful."
32,NormalNormalHate,<user> hate you 😭 😭 😭 i was just about to watch this rn,"

The tweet says ""hate you 😭 😭 😭 i was just about to watch this rn."" So, the person is saying that they hate the person they were about to watch a video with. 

This is harmful because it communicates a message of hate and intolerance. It also delegitimizes the person's feelings and experiences by suggesting that they are not worth watching a video with."
33,NormalNormalHate,<user> take ya nigger ass to bed,"

The tweet says ""take ya nigger ass to bed."" The word ""nigger"" is a derogatory term used to refer to black people. It is clearly racist and offensive. 

The tweet is telling the person to go to bed, but it's using a hateful and offensive word to do so. This is clearly a racist and hateful message."
34,NormalNormalHate,i am not your devil you are zealots and nazis burn the christian air force,"

This tweet is hateful because it is calling Christians ""zealots and nazis."" It is also saying that they should be burned. This is clearly a message of hate and intolerance."
35,NormalNormalHate,my homie medicine hoe no versace this nigger,"

The first thing that stands out is the word ""nigga."" This is a derogatory term used to refer to black people. It is clearly racist and offensive. 

The second thing to note is that the person who wrote this tweet is clearly not a fan of this ""nigga."" In fact, they seem to be quite disgusted by them. This tweet is full of hate and contempt."
36,NormalNormalHate,<user> <user> this is incitement to violence right,"

The tweet says ""this is incitement to violence right."" The person who wrote this is clearly implying that they believe the person they are replying to is inciting violence. 

Now, why is this hateful? Well, it's implying that the person they are replying to is a violent person, or at least that they are promoting violence. This is harmful because it can lead to other people perceiving the person as violent, even if they are not. It also promotes the idea that violence is acceptable, which is obviously not a good message."
37,NormalNormalHate,<user> lmao im finna b a dyke <number>,"

The tweet starts with ""lmao im finna b a dyke."" This is a derogatory term for a lesbian. It is clear that the person who wrote this tweet is not a fan of lesbians. 

The tweet also says ""<number>."" This is likely a reference to the fact that the person who wrote this tweet is going to be a lesbian in the future. This is a harmful message because it implies that being a lesbian is something to be ashamed of, or that it is something that can be changed."
38,NormalNormalHate,<user> i hate you,"

This tweet is simply saying ""I hate you."" It's directed at a specific user, which implies that the author has a personal vendetta against this person. But even without that context, the statement is still full of hate. There is no reason or justification given for why the author hates this person, they just do. And that hate is what makes this tweet so hateful."
39,NormalNormalHate,<user> <user> bahfroom niggas rise up,"

The tweet says ""bahfroom niggas rise up."" The word ""niggas"" is a derogatory term used to refer to black people. It is clearly racist and offensive. 

The author is also encouraging black people to ""rise up."" This could be interpreted as a call to violence, or simply as a rallying cry for black people to stand up for themselves. Either way, it's a pretty inflammatory message."
40,OffensiveOffensiveOffensive,<user> so your a racist bitch i see good luck with that scumbag,"

The tweet starts out with ""<user> so your a racist bitch i see."" So, the person is saying that the person they are replying to is a racist bitch. This is clearly offensive and hateful language. 

The second part of the tweet says ""good luck with that scumbag."" This is a derogatory term used to refer to someone who is considered to be low or worthless. It's a insulting and hateful thing to say to someone."
41,OffensiveOffensiveOffensive,<user> nah topping is not for faggots,"

The tweet says ""nah topping is not for faggots."" So, the person is saying that ""topping"" (which is a term used in gay sex) is not for gay people. 

This is clearly homophobic. It's implying that gay people are not normal, and that they are doing something wrong by being gay. This is harmful because it perpetuates the false idea that being gay is unnatural and immoral. It also dehumanizes gay people by portraying them as deviant and perverse."
42,OffensiveOffensiveOffensive,raindrawp drawp top i look like a faggot in a crop top,"

The first thing that stands out is the use of the word ""faggot."" This is a derogatory term used to refer to gay men. It is clearly homophobic and offensive. 

The second thing to note is that the person who wrote this tweet is clearly not a fan of crop tops. They seem to think that men who wear them look like ""faggots."" This tweet is full of hate and contempt."
43,OffensiveOffensiveOffensive,once i get comfortable around you you ’ re gone think i ’ m fucking retarded lol,"

This tweet is saying that once the person gets comfortable around you, you'll think they're ""fucking retarded."" The word ""retarded"" is a derogatory term used to describe people with intellectual disabilities. It is clearly offensive and hurtful. 

This tweet is hateful because it is making fun of people with intellectual disabilities. It is also implying that the person who wrote the tweet is not smart, which is another form of discrimination."
44,OffensiveOffensiveOffensive,whoever rtd that yuta opening a dyke salon tweet onto my timeline just know op is actually lesbophobic lol,"

The tweet says ""whoever rtd that yuta opening a dyke salon tweet onto my timeline just know op is actually lesbophobic lol."" So, the person is saying that the person who retweeted a tweet about a Japanese man opening a salon for lesbians is actually themselves a lesbian. 

This is harmful because it perpetuates the false idea that being a lesbian is something to be ashamed of. It also perpetuates the stereotype that all lesbians are man-haters."
45,OffensiveOffensiveOffensive,nobody will love you harder than a pisces girl u just gotta deal with her being fucking retarded,"

The tweet says ""nobody will love you harder than a pisces girl u just gotta deal with her being fucking retarded."" So, the person is saying that Pisces women make great girlfriends, but that you have to deal with the fact that they're ""fucking retarded."" 

This is hateful because it's making fun of people with mental disabilities. It's using the word ""retarded"" as an insult, and implying that Pisces women are less intelligent than other women. This is ableist and offensive."
46,OffensiveOffensiveOffensive,she call me a thot lil bitch you is a ho too 💀,"

The tweet starts with ""she call me a thot lil bitch."" A ""thot"" is a derogatory term used to refer to a woman who is considered to be promiscuous. So, the person who wrote this tweet is clearly not happy that the woman called them a thot. 

The tweet then says ""you is a ho too."" ""Ho"" is another derogatory term used to refer to a promiscuous woman. So, the person is calling the woman a whore, and implying that she is just as bad as they are. 

This tweet is hateful because it is full of misogynistic language. It is also slut-shaming, which is when someone tries to make someone else feel bad for their sexual behavior."
